id (PK),title,message,type,created_at,route_id,station_id
1,Route Delay,Red Line buses may be delayed by 10 minutes.,delay,2026-04-20 08:00:00,RT01,R01
2,Station Maintenance,Committee Chowk station is under maintenance.,maintenance,2026-04-20 09:30:00,RT01,R04
3,Schedule Updated,Orange Line schedule has been updated.,schedule_update,2026-04-21 07:00:00,RT02,O01
4,Service Alert,High passenger rush expected during evening hours.,alert,2026-04-21 17:00:00,RT01,R10
5,Route Change,Temporary route change near Faiz Ahmed Faiz station.,route_change,2026-04-22 10:15:00,RT02,O01
